{
  "schemaVersion": "routing-vocabulary/1.0",
  "owner": {
    "kind": "domain",
    "id": "frontend"
  },
  "intentMappings": [
    {
      "signalId": "visual-design",
      "skillIntentIds": ["visual-design"]
    },
    {
      "signalId": "motion-design",
      "skillIntentIds": ["motion-design"]
    },
    {
      "signalId": "responsive-design",
      "skillIntentIds": ["responsive-design"]
    },
    {
      "signalId": "visual-reference",
      "skillIntentIds": ["visual-reference"]
    }
  ],
  "creatableArtifactIds": [
    "web-interface"
  ],
  "entries": [
    {
      "kind": "artifact",
      "id": "web-interface",
      "locale": "mixed",
      "phrases": [
        "website",
        "web site",
        "web interface",
        "landing",
        "сайт",
        "веб сайт",
        "веб интерфейс",
        "интерфейс сайта",
        "landing page",
        "лендинг",
        "сайта",
        "интерфейс по макету"
      ]
    },
    {
    "kind": "artifact",
    "id": "page",
    "locale": "mixed",
    "phrases": [
      "landing",
      "landing page",
      "лендинг",
      "page",
      "pages",
      "страницу",
      "страницы",
      "страницей",
      "страниц"
    ]
    },
    {
      "kind": "technology",
      "id": "tailwind",
      "locale": "mixed",
      "phrases": ["tailwind", "tailwind css"]
    },
    {
      "kind": "technology",
      "id": "nextjs",
      "locale": "mixed",
      "phrases": ["next.js", "nextjs", "app router"]
    },
    {
      "kind": "technology",
      "id": "rsc",
      "locale": "mixed",
      "phrases": ["rsc", "react server components", "server components"]
    },
    {
      "kind": "intent",
      "id": "next-app-router-review",
      "locale": "mixed",
      "phrases": [
        "route handler",
        "route handlers",
        "server action",
        "server actions",
        "роут хэндлер",
        "роут хендлер",
        "серверный экшен",
        "серверные экшены",
        "rsc",
        "app router"
      ],
      "negativePhrases": [
        "create",
        "design",
        "сделай",
        "создай",
        "спроектируй"
      ]
    },
    {
      "kind": "quality",
      "id": "visual-quality",
      "locale": "mixed",
      "phrases": ["визуальное качество", "visual quality"]
    },
    {
      "kind": "quality",
      "id": "responsiveness",
      "locale": "mixed",
      "phrases": ["адаптивность", "адаптивный интерфейс", "responsiveness", "responsive interface"]
    },
    {
      "kind": "intent",
      "id": "visual-design",
      "locale": "mixed",
      "phrases": [
        "красивый дизайн",
        "красивым дизайном",
        "стильный дизайн",
        "современный дизайн",
        "визуальный дизайн",
        "визуальным дизайном",
        "дорогой вид",
        "премиальный вид",
        "сделай красиво",
        "визуально привлекательно",
        "не шаблонный дизайн",
        "beautiful design",
        "visually impressive",
        "polished design",
        "premium look",
        "modern visual style",
        "make it look great",
        "visually appealing",
        "non-generic design",
        "красивый адаптивный сайт",
        "удобный веб интерфейс",
        "выглядел современно",
        "красивый сайт",
        "более красивым",
        "polished visuals",
        "clean analytics web interface",
        "polished website",
        "polished responsive pricing component",
        "доступную форму",
        "accessible checkout form",
        "accessible contact form",
        "плавными переходами",
        "smooth animations",
        "плавными animations",
        "мобайл адаптацию",
        "for mobile",
        "responsive design"
      ]
    },
    {
      "kind": "intent",
      "id": "motion-design",
      "locale": "mixed",
      "phrases": [
        "анимация",
        "анимации",
        "анимациями",
        "плавные анимации",
        "плавными анимациями",
        "плавные переходы",
        "оживить интерфейс",
        "сделать интерфейс живее",
        "движение элементов",
        "animation",
        "animations",
        "subtle motion",
        "smooth transitions",
        "bring the interface to life",
        "make the UI feel alive",
        "animated elements",
        "плавными переходами",
        "smooth animations"
      ]
    },
    {
      "kind": "intent",
      "id": "responsive-design",
      "locale": "mixed",
      "phrases": [
        "адаптивный дизайн",
        "мобильная адаптация",
        "мобильной адаптацией",
        "мобайл адаптация",
        "мобайл адаптацией",
        "под телефон",
        "на телефоне",
        "под разные экраны",
        "не ломается на мобильном",
        "хорошо выглядит на телефоне",
        "responsive design",
        "mobile responsive",
        "phone support",
        "works on phones",
        "different screen sizes",
        "does not break on mobile",
        "looks good on mobile",
        "адаптивный сайт",
        "responsive layout",
        "for mobile",
        "responsive pricing component",
        "мобайл адаптацию"
      ]
    },
    {
      "kind": "intent",
      "id": "visual-reference",
      "locale": "mixed",
      "phrases": [
        "по макету",
        "на основе макета",
        "макет приложен",
        "есть готовый макет",
        "из figma",
        "файл figma приложен",
        "по этому скриншоту",
        "вот скриншот",
        "используй этот скриншот",
        "используй приложенный макет",
        "визуальный референс приложен",
        "from this mockup",
        "based on this mockup",
        "mockup attached",
        "from this screenshot",
        "based on this screenshot",
        "here is the screenshot",
        "use this screenshot",
        "use the attached mockup",
        "from this figma file",
        "design file attached",
        "use this visual reference"
      ],
      "negativePhrases": [
        "без скриншота",
        "без макета",
        "нет скриншота",
        "нет макета",
        "не используй этот скриншот",
        "не используй приложенный макет",
        "no screenshot",
        "without a screenshot",
        "without a mockup",
        "do not use this screenshot",
        "do not use the attached mockup"
      ]
    }
  ]
}
